"DESCRIPTION","DURATION IN MS","NAME","PARENT SUITE","START TIME","STATUS","STOP TIME","SUB SUITE","SUITE","TEST CLASS","TEST METHOD"
"Adds two products to the cart then verifies both items and their details","2690","Should add products to cart and verify details","TC_012 - Add Products in Cart","Sat Dec 27 10:15:23 UTC 2025","passed","Sat Dec 27 10:15:26 UTC 2025","","","",""
"Validates the entire flow of submitting the Contact Us form, including file upload, success message verification, and navigation back to the Home Page.","4865","Should submit Contact Us form successfully and return to home page","TC_006 - Contact Us Flow Test","Sat Dec 27 10:15:08 UTC 2025","passed","Sat Dec 27 10:15:13 UTC 2025","","","",""
"Validates user registration followed by account deletion","16826","Should register while checkout and place order successfully","TC_014 - Place Order: Register while Checkout","Sat Dec 27 10:15:29 UTC 2025","passed","Sat Dec 27 10:15:46 UTC 2025","","","",""
"","5423","Should login and delete user successfully","TC_002 - Login Flow Test","Sat Dec 27 10:14:59 UTC 2025","passed","Sat Dec 27 10:15:04 UTC 2025","","","",""
"Search for a product by name and verify the results page and items","2791","Should search a product and verify search results","TC_009 - Search Product Functionality","Sat Dec 27 10:15:17 UTC 2025","passed","Sat Dec 27 10:15:20 UTC 2025","","","",""
